{
  "events": [],
  "initial_tray": {
    "100": 2,
    "1000": 1,
    "500": 1
  },
  "kind": "regular",
  "line_id": "line_gamaa",
  "max_earnings_jenehat": 60,
  "passengers": [
    {
      "archetype": "honest",
      "dest_station_id": "gamaa",
      "passenger_id": "p1",
      "payment": [
        1000
      ],
      "pays_at_seconds": 2,
      "seat_id": "front_r",
      "skin": "effendi_suit"
    },
    {
      "archetype": "hurry",
      "dest_station_id": "kobri",
      "passenger_id": "p2",
      "payment": [
        1000
      ],
      "pays_at_seconds": 5,
      "seat_id": "A_l",
      "skin": "effendi_tie"
    },
    {
      "archetype": "group_payer",
      "dest_station_id": "kobri",
      "group_id": "g1",
      "group_size": 3,
      "passenger_id": "p3",
      "payment": [
        5000
      ],
      "seat_id": "B_m",
      "skin": "young_cap"
    },
    {
      "archetype": "sleeper",
      "dest_station_id": "mostashfa",
      "passenger_id": "p4",
      "payment": [
        5000
      ],
      "seat_id": "C_m",
      "skin": "worker_blue"
    }
  ],
  "rev": 1,
  "rules": {
    "bag_fare_piasters": 0,
    "child_free_age": 6,
    "max_break_requests": 2,
    "no_fights_required": false,
    "student_discount_pct": 0
  },
  "seats": [
    {
      "col": "r",
      "reachable_by_driver": true,
      "row": "front",
      "seat_id": "front_r"
    },
    {
      "col": "r",
      "reachable_by_driver": true,
      "row": "A",
      "seat_id": "A_r"
    },
    {
      "col": "m",
      "reachable_by_driver": true,
      "row": "A",
      "seat_id": "A_m"
    },
    {
      "col": "l",
      "reachable_by_driver": true,
      "row": "A",
      "seat_id": "A_l"
    },
    {
      "col": "r",
      "reachable_by_driver": false,
      "row": "B",
      "seat_id": "B_r"
    },
    {
      "col": "m",
      "reachable_by_driver": false,
      "row": "B",
      "seat_id": "B_m"
    },
    {
      "col": "l",
      "reachable_by_driver": false,
      "row": "B",
      "seat_id": "B_l"
    },
    {
      "col": "r",
      "reachable_by_driver": false,
      "row": "C",
      "seat_id": "C_r"
    },
    {
      "col": "m",
      "reachable_by_driver": false,
      "row": "C",
      "seat_id": "C_m"
    },
    {
      "col": "l",
      "reachable_by_driver": false,
      "row": "C",
      "seat_id": "C_l"
    }
  ],
  "seed": 863582631,
  "star_rules": {
    "three": "no_fights_no_mistakes",
    "two": "no_fights"
  },
  "stations": [
    {
      "at_seconds": 44,
      "fare_piasters": 450,
      "station_id": "kobri"
    },
    {
      "at_seconds": 76,
      "fare_piasters": 700,
      "station_id": "mostashfa"
    },
    {
      "at_seconds": 106,
      "fare_piasters": 900,
      "station_id": "gamaa"
    }
  ],
  "trip_id": "line_gamaa.68",
  "vehicle_id": "micro_old"
}
