{
  "events": [],
  "initial_tray": {
    "100": 2,
    "50": 4,
    "500": 1
  },
  "kind": "regular",
  "line_id": "line_hay",
  "max_earnings_jenehat": 20,
  "passengers": [
    {
      "archetype": "regular",
      "dest_station_id": "madrasa",
      "passenger_id": "p1",
      "payment": [
        1000
      ],
      "pays_at_seconds": 3,
      "seat_id": "A_r",
      "skin": "effendi_suit"
    },
    {
      "archetype": "student",
      "dest_station_id": "forn",
      "passenger_id": "p2",
      "payment": [
        1000
      ],
      "pays_at_seconds": 8,
      "seat_id": "A_l",
      "skin": "student_cap"
    }
  ],
  "rev": 1,
  "rules": {
    "bag_fare_piasters": 0,
    "child_free_age": 6,
    "max_break_requests": 2,
    "no_fights_required": false,
    "student_discount_pct": 50
  },
  "seats": [
    {
      "col": "r",
      "reachable_by_driver": true,
      "row": "A",
      "seat_id": "A_r"
    },
    {
      "col": "m",
      "reachable_by_driver": true,
      "row": "A",
      "seat_id": "A_m"
    },
    {
      "col": "l",
      "reachable_by_driver": true,
      "row": "A",
      "seat_id": "A_l"
    }
  ],
  "seed": 338787917,
  "star_rules": {
    "three": "no_fights_no_mistakes",
    "two": "no_fights"
  },
  "stations": [
    {
      "at_seconds": 35,
      "fare_piasters": 700,
      "station_id": "madrasa"
    },
    {
      "at_seconds": 60,
      "fare_piasters": 700,
      "station_id": "forn"
    }
  ],
  "trip_id": "line_hay.51",
  "vehicle_id": "tuktuk"
}
