{
  "events": [],
  "initial_tray": {
    "100": 3
  },
  "kind": "story",
  "line_id": "line_hay",
  "max_earnings_jenehat": 15,
  "passengers": [
    {
      "archetype": "chatty",
      "dest_station_id": "mahatta",
      "passenger_id": "p1",
      "payment": [
        1000
      ],
      "seat_id": "A_m",
      "skin": "effendi_suit",
      "speech_keys": {
        "pays": "passenger.pays",
        "wants_change": "passenger.wants_change"
      }
    },
    {
      "archetype": "regular",
      "dest_station_id": "forn",
      "passenger_id": "p2",
      "payment": [
        500,
        100,
        100
      ],
      "seat_id": "A_r",
      "skin": "student_cap"
    }
  ],
  "rev": 1,
  "rules": {
    "bag_fare_piasters": 0,
    "child_free_age": 6,
    "max_break_requests": 2,
    "no_fights_required": true,
    "student_discount_pct": 0
  },
  "seats": [
    {
      "col": "r",
      "reachable_by_driver": true,
      "row": "A",
      "seat_id": "A_r"
    },
    {
      "col": "m",
      "reachable_by_driver": true,
      "row": "A",
      "seat_id": "A_m"
    },
    {
      "col": "l",
      "reachable_by_driver": true,
      "row": "A",
      "seat_id": "A_l"
    }
  ],
  "seed": 899928511,
  "star_rules": {
    "three": "no_fights_no_mistakes",
    "two": "no_fights"
  },
  "stations": [
    {
      "at_seconds": 36,
      "fare_piasters": 700,
      "station_id": "forn"
    },
    {
      "at_seconds": 66,
      "fare_piasters": 700,
      "station_id": "mahatta"
    }
  ],
  "trip_id": "line_hay.56",
  "vehicle_id": "tuktuk"
}
