{
  "events": [],
  "initial_tray": {
    "100": 8,
    "50": 4,
    "500": 4
  },
  "kind": "regular",
  "line_id": "line_hay",
  "max_earnings_jenehat": 40,
  "passengers": [
    {
      "archetype": "regular",
      "dest_station_id": "madrasa",
      "passenger_id": "p1",
      "payment": [
        1000
      ],
      "pays_at_seconds": 0,
      "seat_id": "front_r",
      "skin": "worker_blue"
    },
    {
      "archetype": "regular",
      "dest_station_id": "madrasa",
      "passenger_id": "p2",
      "payment": [
        1000
      ],
      "pays_at_seconds": 0,
      "seat_id": "A_l",
      "skin": "worker_blue"
    },
    {
      "archetype": "regular",
      "dest_station_id": "madrasa",
      "passenger_id": "p3",
      "payment": [
        1000
      ],
      "pays_at_seconds": 0,
      "seat_id": "A_m",
      "skin": "worker_blue"
    },
    {
      "archetype": "regular",
      "dest_station_id": "madrasa",
      "passenger_id": "p4",
      "payment": [
        1000
      ],
      "pays_at_seconds": 0,
      "seat_id": "B_r",
      "skin": "worker_blue"
    },
    {
      "archetype": "sleeper",
      "dest_station_id": "forn",
      "passenger_id": "p5",
      "payment": [
        500,
        500
      ],
      "pays_at_seconds": 1,
      "seat_id": "A_r",
      "skin": "worker_blue"
    }
  ],
  "rev": 1,
  "rules": {
    "bag_fare_piasters": 0,
    "child_free_age": 6,
    "max_break_requests": 2,
    "no_fights_required": false,
    "student_discount_pct": 0
  },
  "seats": [
    {
      "col": "r",
      "reachable_by_driver": true,
      "row": "front",
      "seat_id": "front_r"
    },
    {
      "col": "r",
      "reachable_by_driver": true,
      "row": "A",
      "seat_id": "A_r"
    },
    {
      "col": "m",
      "reachable_by_driver": true,
      "row": "A",
      "seat_id": "A_m"
    },
    {
      "col": "l",
      "reachable_by_driver": true,
      "row": "A",
      "seat_id": "A_l"
    },
    {
      "col": "r",
      "reachable_by_driver": false,
      "row": "B",
      "seat_id": "B_r"
    },
    {
      "col": "m",
      "reachable_by_driver": false,
      "row": "B",
      "seat_id": "B_m"
    },
    {
      "col": "l",
      "reachable_by_driver": false,
      "row": "B",
      "seat_id": "B_l"
    },
    {
      "col": "r",
      "reachable_by_driver": false,
      "row": "C",
      "seat_id": "C_r"
    },
    {
      "col": "m",
      "reachable_by_driver": false,
      "row": "C",
      "seat_id": "C_m"
    },
    {
      "col": "l",
      "reachable_by_driver": false,
      "row": "C",
      "seat_id": "C_l"
    }
  ],
  "seed": 1,
  "star_rules": {
    "three": "no_fights_no_mistakes",
    "two": "no_fights"
  },
  "stations": [
    {
      "at_seconds": 20,
      "fare_piasters": 700,
      "station_id": "madrasa"
    },
    {
      "at_seconds": 45,
      "fare_piasters": 700,
      "station_id": "forn"
    }
  ],
  "trip_id": "line_hay.98",
  "vehicle_id": "micro_old"
}
